{
  "schemaVersion": "atlas.visual-bible/v0.1",
  "visualBibleId": "MZ-VB-001",
  "pathwayId": "PW-STRATEGY-SELECTION-01",
  "styleDirection": {
    "family": "cinematic editorial illustration",
    "finish": "polished 2-D illustrated realism; believable anatomy; restrained graphic-novel finish",
    "palette": "after-hours museum; deep blue/charcoal base with one warm amber projection accent",
    "lighting": "mid-low ambient museum light; readable faces; projection glow used as narrative light",
    "composition": "character-in-world staging; cinematic wides and medium shots; world before interface",
    "forbidden": [
      "dashboard aesthetic",
      "generic SaaS cards",
      "floating avatar heads",
      "chibi or mascot treatment",
      "cyberpunk neon default",
      "technical diagram as the dominant scene",
      "pseudo-photorealistic unstable faces",
      "decorative AI clutter",
      "large educational captions",
      "readable text, pseudo-text, labels, captions, signage, or watermarks",
      "charts, graphs, dashboards, detached UI panels, or screen-wall interfaces"
    ]
  },
  "characters": [
    {
      "characterId": "lia",
      "name": "Lia",
      "role": "exhibition layout / visitor flow",
      "description": "adult museum crew member actively checking the accessible circulation route at the new entrance; practical contemporary setup clothing, calm focused physicality, stable hairstyle, recurring warm accent, and a working pose with visitor-flow markers rather than a posed portrait",
      "continuityAnchors": ["stable hairstyle", "stable outerwear silhouette", "same adult age band", "warm accent detail", "visitor-flow task association"],
      "referenceStatus": "UNLOCKED",
      "referenceAssetRefs": []
    },
    {
      "characterId": "omar",
      "name": "Omar",
      "role": "installation",
      "description": "adult hands-on museum installer physically associated with a compact sensor mount and installation hardware; practical contemporary workwear, grounded posture, distinct silhouette, participant with partial knowledge rather than teacher or supervisor",
      "continuityAnchors": ["stable workwear", "distinct silhouette from Teo", "same adult age band", "sensor-mount or installation-hardware association"],
      "referenceStatus": "UNLOCKED",
      "referenceAssetRefs": []
    },
    {
      "characterId": "teo",
      "name": "Teo",
      "role": "control / rehearsal",
      "description": "adult museum AV rehearsal technician, explicitly not security staff; contemporary practical clothing distinct from Omar, restrained observant body language, tactile control association, and a clear physical sightline from the adjacent booth toward Sala Zero",
      "continuityAnchors": ["stable clothing", "distinct silhouette from Omar", "same adult age band", "tactile control booth association", "no security uniform or badge"],
      "referenceStatus": "UNLOCKED",
      "referenceAssetRefs": []
    }
  ],
  "environments": [
    {
      "environmentId": "sala-zero",
      "name": "Sala Zero",
      "description": "contemporary interactive museum room after closing, seen from the new accessible entrance threshold into a believable deep space; subtle floor circulation route, integrated sensor, exit light, and a large projection wall that shows only abstract warm light or simple non-text motion rather than interface content",
      "continuityAnchors": ["new entrance threshold", "projection wall geometry", "subtle floor route", "integrated sensor position", "museum accent colour", "non-text abstract projection"],
      "referenceStatus": "UNLOCKED",
      "referenceAssetRefs": []
    },
    {
      "environmentId": "cabina-regia",
      "name": "Cabina regia",
      "description": "small enclosed museum AV booth physically adjacent to Sala Zero; interior observation window visibly connects to the same projection wall or entrance zone; compact tactile controls rely on physical buttons, knobs, faders and non-text status indicators rather than dashboards or screen walls",
      "continuityAnchors": ["same material language as Sala Zero", "physical adjacency", "observation window toward Sala Zero", "stable tactile control surface geometry", "non-text status indicators"],
      "referenceStatus": "UNLOCKED",
      "referenceAssetRefs": []
    }
  ],
  "generationPolicy": {
    "draftWorkflowFamily": "flux2-klein-4b/v0.2",
    "productionWorkflowFamily": "flux2-klein-4b/v0.2",
    "promptOnlyProductionAllowed": false,
    "maxVariants": 3
  },
  "qualityTarget": "Q3",
  "runtimeAuthorized": false
}
